{
  "formatVersion": "1.0.0",
  "ruleId": "SEC-001",
  "ruleHash": "630cc34d315bdd90cd3049bbb4fc8b535e686480bd8844107638a1c60c7fba15",
  "assetId": "fictional-example",
  "environmentRevision": "replace-with-actual-environment-revision",
  "observedAt": "2026-10-26T00:00:00Z",
  "scope": "Fictional example only; no inspection performed",
  "observations": [
    {
      "id": "example-1",
      "text": "Fictional example: deployed versions and advisories have not been collected.",
      "locator": "example only; no real evidence"
    }
  ]
}
